Aldi,aldi american,hello rusdefaultisms automoderator think submission fit us defaultism upvote comment downvote think submission break rusdefaultism rule please report moderation team bot action perform automatically please contact moderator subredditmessagecomposetorusdefaultism question concern wait til tell actually two aldis name profile picture explain lot though wouldnt surprise believe italian stole pizza italianamericans briton decide start accent lose revolutionary war one ever happen apparently saw post annals time facebook fellow apoplectic rage find concorde britishfrench us nothing america sell alcohol supermarket,2023-09-02 22:05:12,Neutral,0.0,Negative,-0.0091128205128205,-0.0091128205128205,Negative,"{'neg': 0.135, 'neu': 0.786, 'pos': 0.08, 'compound': -0.7108}"
Aldi,prime drink aldi uk,mirror mirror provide usaveanything downloads download provide uvideotrim download provide usavevideo download provide udownloadvideo note bot provide directory service trouble link please contact user provide source code run mirror bot let integrate get special sort ct willing get bed morning go shop fight someone energy drink theyre wanker wait theyre lining brawndo,2022-12-29 12:26:21,Neutral,0.0,Negative,-0.0075830188679245,-0.0075830188679245,Negative,"{'neg': 0.142, 'neu': 0.743, 'pos': 0.115, 'compound': -0.4019}"
Aldi,smith scam open packed smith original chip find packet aldis brand chip obviously smith also manufacture aldi brand significantly cheap thing,thats actually true youve discover buy product aldi cheap content yep thing use work fruit processing factory make stuff aldi weight warchers company come line people buy csr brand sugar brand come sugar people think get good quality brand name packaging store brand last year nicer package simple old white packaging work australian confectionery manufacturer exact product go branded product go aldi aldi sell cheap aldi guarantee sale buy bulk cut extra charge like rebate major minor include thing allow cheap price manufacturer work local cheese factory would swap sticker sell aldi batch number wrap sticker also cheap one cole woolworth also cheese iga community co brand,2023-05-07 06:47:43,Negative,-0.34,Positive,0.0085611111111111,0.0085611111111111,Positive,"{'neg': 0.018, 'neu': 0.826, 'pos': 0.156, 'compound': 0.9246}"
Aldi,aldi start self checkout cash option unfortunately,one reason avoid aldi usually go get thing always get stick behind someone full shop excite find finally provide basket never shop dont buy enough need trolley much carry loose id rather launch grocery speed sound somehow manage go faster faster try keep much hate self checkout well stressful experience regular checkout theyve local aldi,2023-04-24 02:17:06,Negative,-0.34,Negative,-0.0132678571428571,-0.0132678571428571,Negative,"{'neg': 0.175, 'neu': 0.746, 'pos': 0.079, 'compound': -0.743}"
Aldi,aldi shop deliveryto floor keep mind aldi provide bag bunch juice milk,would accept order lol wouldve add paper bag order use put cx order box grab paper bag think theyll need give extra afford pay extra fee dd go pick time cant hard aldi provide bags charge simply purchase bag delivery order want paper bag well please im cashier aldi truly shock many people dont know people try purchase bag money im like uh customer pay typical non tipper logic tough fuck live situation,2023-05-07 15:00:22,Neutral,0.0,Positive,0.0101391891891891,0.0101391891891891,Positive,"{'neg': 0.118, 'neu': 0.68, 'pos': 0.202, 'compound': 0.7503}"
Aldi,full aldi fit,get aldi girl chuck mangione switch megalomart aldidas total cost plus get quarter back go walk round lidl,2023-03-23 15:20:57,Positive,0.3612,Neutral,0.0,0.0,Neutral,"{'neg': 0.0, 'neu': 1.0, 'pos': 0.0, 'compound': 0.0}"
Aldi,aldi become trendy,well poor think big part trendiness aldi find since theyre always rotate exclusivity play draw hype also think lot people realize good option dont remember aldi sham others always hat mom get aldi snack grow cause didnt taste maybe im pay taste pretty good lol social medium help make diy thrifty become see mainstream many us always normal nbsp ive dabble onoff aldis past ive start really go consistently aldis lately since app price stick around week family four shop completely wegmans even though high cost could add everything list know go spend someone adhd choice overload nice feel overwhelm eight brand everything cant beat aldi find pop every aldi wasnt accessible til year ago least area start open great promos instacart give coupon store etc fil refuse shop bc poor store rich finally step foot one month ago refuse go elsewhere fact weekly special non grocery item make place people line specialty week item like current german week keep regular customer shop bring new one price go lot local aldi cheap almost go big grocer fact sell specialty weekly item keep us,2023-09-30 04:05:45,Neutral,0.0,Positive,0.0052239130434782,0.0052239130434782,Positive,"{'neg': 0.075, 'neu': 0.763, 'pos': 0.161, 'compound': 0.9612}"
Aldi,people werent lie fast work aldi lidl etc,decide put cart speed sort later pay first people behind dont wait way year germany never even bother stress try keep cashier anymore im certainly good tick faster thats literally youre suppose thats trolley fit end checkout even trained german cant pack fast aldian scan likely alien delete put stuff conveyor belt reverse order hard stuff chunky stuff first nothing crush go last turn place bag counter start put like madman fail play tetri fail havent play tetris practice take time pick one point even manage crack joke first week bring towle sweat,2023-10-11 17:14:40,Neutral,0.0,Positive,0.0094010638297872,0.0094010638297872,Positive,"{'neg': 0.088, 'neu': 0.706, 'pos': 0.207, 'compound': 0.8837}"
Aldi,get aldis week,play spot expensive thing right meat cheese egg hard know price egg see protein chew grocery bill seem kinda expensive purchase bad good amount protein grocery get ridiculous get whole cart aldi idk leave much joke,2023-02-03 13:58:49,Neutral,0.0,Negative,-0.0016459459459459,-0.0016459459459459,Negative,"{'neg': 0.215, 'neu': 0.619, 'pos': 0.166, 'compound': -0.0609}"
Aldi,new camera aldi self checkout,huh didnt know aldi even self checkouts screens woolies get nothing fake screen literally front face camera display screen ethernet wifi connection storage either one monitor one checkout camera mount ceiling screen ethernet dont connect high bun business mean delete im wait dan murphy self checkout ill sort,2023-06-06 12:03:16,Neutral,0.0,Negative,-0.0012938775510204,-0.0012938775510204,Negative,"{'neg': 0.055, 'neu': 0.896, 'pos': 0.05, 'compound': -0.0634}"
Aldi,aldi myth,comment nj unless amaze sale supermarket even compare amount get aldi price aldi myth im south publix major competitor im kid say certain day ive save least switch aldi still thing go get publix dramatic difference haha meijer soooooo expensive aldi myth shop month copare cost month grocery way dont get fool meijers sophisticated pricing strategy give shopper false sense good value save item buy learn embrace lack choice everything lot brand choice like green bean likely one kind help low price small store experience nice adjust idea oh take quarter,2023-10-13 19:45:10,Neutral,0.0,Positive,0.0107260869565217,0.0107260869565217,Positive,"{'neg': 0.037, 'neu': 0.628, 'pos': 0.335, 'compound': 0.9868}"
Aldi,someone tag aldis,mom make amaze spice nut christmas swears aldis buy nut husband every year crack say love aldis nut mouth aldis hot nut theyre fresh oven holiday tradition id probably start suspect anyone noticed lot people refer store aldis instead aldi always find weird awfully disrespectul place allow get week grocery im struggle one people outside austalia pronounce aldi alldi rmildlyvandalised,2020-05-10 21:04:51,Neutral,0.0,Positive,0.0142770491803278,0.0142770491803278,Positive,"{'neg': 0.085, 'neu': 0.696, 'pos': 0.219, 'compound': 0.8709}"
Aldi,great european aldi war,call aldi equator look lot like war austrian succession haus sudsuissehofer v house nordjoe aldi sd roughly cover catholic area country part roman empire back aldi nord mainly business part germany tell rome fuck twice first antiquity protestant reformation never think would side prussian aldi danmark,2023-05-03 21:22:09,Positive,0.0516,Negative,-0.013295744680851,-0.013295744680851,Negative,"{'neg': 0.14, 'neu': 0.778, 'pos': 0.082, 'compound': -0.6249}"
Aldi,best way divide europe aldi nord europe aldi sd europe,austria aldi call hofer use logo aldi sd doesnt make much sense bit history austria first foreign market outside germany aldi sd buy small grocery chain name hofer late day keep name edit also apperently slovenia theyre call hofer guess somehow expand austria swedes frugal enough aldi second division germany mr aldi tear wall gb south yes thats nice division wonder would happen somebody get yeeted window prague,2020-11-23 15:04:37,Positive,0.6369,Positive,0.0112797101449275,0.0112797101449275,Positive,"{'neg': 0.0, 'neu': 0.893, 'pos': 0.107, 'compound': 0.7783}"
Aldi,selfcheckout local aldi,um wheres chair supermarket self service slow love self checkout aldi one loud dont need immediately tell bag every fucking item dont offer volume control im go back realhuman checkouts find one week brissy scan item say needed staff assistance obviously theres staff even give assistance apart check chick already flat time use,2023-01-11 08:48:22,Neutral,0.0,Positive,0.0117944444444444,0.0117944444444444,Positive,"{'neg': 0.0, 'neu': 0.925, 'pos': 0.075, 'compound': 0.6369}"
Aldi,aldi grocery haul,hell yeah love aldi great price without support walmart get home aldi go pretty far im go aldi today actually wish aldi canada local safeway would get item would least live probably dont aldis pnw hope invest store grocery price insane almost option kroger fred meyer qfc safewayalbertsons merger approve shit fuck price,2023-09-03 15:01:11,Neutral,0.0,Negative,-0.0073111111111111,-0.0073111111111111,Negative,"{'neg': 0.246, 'neu': 0.542, 'pos': 0.212, 'compound': -0.3948}"
Aldi,inflation term aldi,thanks confirm alarm day buy egg notice middle shop dawn remember last year follow word come mouth rhyme duck thanks nice actually see someone proper comparison tesco shop jump similar stuff purchase poor people inflation much high spend big proportion income thing like fuel electricity basic food yeah weekly shop come never weekly shop high since get married year ago year ago struggle break mark unless go overboard stressful time time calorie deficit,2022-08-22 17:15:36,Neutral,0.0,Negative,-0.0017297297297297,-0.0017297297297297,Negative,"{'neg': 0.153, 'neu': 0.699, 'pos': 0.148, 'compound': -0.128}"
Aldi,farmer market sell aldi produce stall,lad english market catch year ago fair play call think thats though organises farmer market theyd worth notifying price selling apple find market location website contact organiser often opw public org private market company report iofga similar organic certification display report organisation check bord bia weve family business bust bollock stuff right grifter us harm mention people need report edit im pure rag correct clarity name shame stall holder market market near two farmer sell stuff one lad sell wholesale stuff truck people take pick one thing could tell trader market couple assume good sell market supermarket food mark probs wont anything might make fellow trader actually sell organicartisanalcraft etc become hostile,2023-09-15 14:58:01,Negative,-0.2023,Positive,0.0004566371681415,0.0004566371681415,Positive,"{'neg': 0.087, 'neu': 0.816, 'pos': 0.097, 'compound': 0.0516}"
Aldi,im get tire tell shop aldi,week year get deposit house stop eat woolies smash avo feta toast go aldi buy cereal leave new ski goggles toilet roll organiser salami telescope truth op weve trick think money issue due us personally didnt shop thrifty enough buy extra item couldnt say fav real financial change mean society economy whole need change cant thrift way house family cut back shop aldi save deposit unless youre severely spender real issue wage go small increment record profit rake billionaire raise cost living lifetime shit fuck mate agree reckon lot people forget time ultimate currency save dollar expense time weigh really worth internet go farmer market average farmer market make artisan alabaster wheat loaf take tip top actually get factory authentic dollar per loaf try microgreens,2023-02-24 23:54:10,Neutral,0.0,Negative,-0.0021444444444444,-0.0021444444444444,Negative,"{'neg': 0.143, 'neu': 0.735, 'pos': 0.122, 'compound': -0.2702}"
Aldi,strike nurse say earn similar less stressed work aldi,us emts dangerous work make aldi aldi even give chair ny aldi start cashier city manager theyre pretty picky hire though interview last year manager bluntly tell chance low college degree make overqualified edit nurse look drastically underpaid uk id strike nurse pay disgrace uk support completely grocery store afford pay nurse give idea underpay anyone healthcare consider insane profit hospital healthcare industry general,2023-05-15 01:12:10,Negative,-0.3832,Negative,-0.0058738461538461,-0.0058738461538461,Negative,"{'neg': 0.194, 'neu': 0.669, 'pos': 0.136, 'compound': -0.3818}"
Aldi,post aldi group,lmfaooooo one bad attempt sell product ive see woman come shop one time ask color street dont sell obvs show comparable one shes like friend tell color street best say direct networking company often cause financial ruin rep im sure want would easy find someone sell complained manager bc sell colorstreet want see would carry product point inventiveness point think corporate store location state alone would peddle crap wrap ham finger eat fake nail really hope comment like know use slice deli meat ham btw nail decal edible second time week example aldi board mlm shenanigans come,2021-02-19 06:06:15,Neutral,0.0,Positive,0.0032316326530612,0.0032316326530612,Positive,"{'neg': 0.161, 'neu': 0.651, 'pos': 0.188, 'compound': 0.3167}"
Aldi,old spot kinda evolve aldi cream cheese,please remember follow rule post dont ask medical advice steal content post link original video properly flairmarktitle post wacky wednesday content wednesday food even wednesday comment comment hygiene appearance absolutely sexual comment sexual harassment instant permanent ban dont rude observe reddiquette comment make automatically post bot action perform automatically please contact moderator subredditmessagecomposetorpopping question concern aldi specifically lol butbut wheres rest video definitely skip one minute mark meaning could go doctor something small fussed doctor ram atm dont need pester lol get bad shall,2023-03-17 21:47:07,Neutral,0.0,Positive,0.0026070588235294,0.0026070588235294,Positive,"{'neg': 0.132, 'neu': 0.699, 'pos': 0.169, 'compound': 0.2216}"
Aldi,aggressive aldi checker quick checker item nightmare mom,loyal aldi shopper say worker refuse slow scan even food fell allocate pack area onto floor like slot machine could see struggle tin finally fell begin cry shaking say knelt floor pick food simultaneously try watch child ask cashier please stop scan food felt like throw item nicola say receive blunt aggressive response cashier accuse pack quickly enough dub liar accusation aldi weak always think aldi table behind cashier bag shop normally chuck everything back trolley basket bag pay cashier keep number get leave quicker thought prayer pretty sure cashier german,2022-06-07 08:31:50,Negative,-0.1531,Negative,-0.0072880434782608,-0.0072880434782608,Negative,"{'neg': 0.224, 'neu': 0.627, 'pos': 0.15, 'compound': -0.6705}"
Aldi,fifteen dollar rain jacket aldi,magneto look awesome long story need lightweight shell upcoming trip central europe really didnt want spend much since normally dress formally often aldi aisle shame come big dick back town suit charmingly well friend fresh death,2023-09-13 18:02:56,Neutral,0.0,Positive,0.012881081081081,0.012881081081081,Positive,"{'neg': 0.22, 'neu': 0.503, 'pos': 0.277, 'compound': 0.4766}"
Aldi,marketing folk aldi god,finally hire dad pay someone explain please english obviously perfect edit obligatory edit give love plantain step identify song write word step sing self step invoke rhyme skill step ha offer mary vary store,2018-04-30 15:28:57,Positive,0.2732,Positive,0.0258342857142857,0.0258342857142857,Positive,"{'neg': 0.033, 'neu': 0.674, 'pos': 0.293, 'compound': 0.9042}"
Aldi,stole aldi quarter,honesty test fail think raldi moment people draw blood touch quarter min wage car detail dude vacuum console didnt even see coin get sucked mechanic undercover kia boy use buy pop wash bologna sandwich ate sit car mmmm,2023-09-21 15:25:55,Neutral,0.0,Negative,-0.0209641025641025,-0.0209641025641025,Negative,"{'neg': 0.223, 'neu': 0.71, 'pos': 0.067, 'compound': -0.8176}"
Aldi,aldi social medium team deserve pay rise,pronounce dick itvx post favourite reddit follow suit reddix oh wait maybe mins paint quality bit troll great stuff aldi social medium team absolutely deserve great work get attention different platform,2023-07-25 10:42:52,Negative,-0.1027,Positive,0.022175,0.022175,Positive,"{'neg': 0.084, 'neu': 0.709, 'pos': 0.208, 'compound': 0.7096}"
Aldi,thanks hate aldi,ironically none aldi ahhh convenience store moviestv videogames use avoid sue copyright infringement gon na ignore fact butter great value walmart brand creme betweens like spend weekend wow totally thought butter mean butter mean fact real butter,2020-05-29 18:21:07,Negative,-0.2023,Positive,0.0189052631578947,0.0189052631578947,Positive,"{'neg': 0.154, 'neu': 0.593, 'pos': 0.253, 'compound': 0.7184}"
Aldi,back aldi,amaze cat actually sit rather box come throne itll simper biped update spoilt kitty bugger cat need deserves,2022-03-30 19:04:59,Neutral,0.0,Positive,0.0285421052631578,0.0285421052631578,Positive,"{'neg': 0.0, 'neu': 0.829, 'pos': 0.171, 'compound': 0.5423}"
Aldi,aldi best sale,fair fuck huge discount im fume spend grand last week apparently market guy aldi use work one jewellery tv channel like fact actual person look thought seem ok put display change im k debt arseholes either damn fine tart mr kipling really suffer troubling time,2021-05-23 18:11:55,Positive,0.6369,Negative,-0.0162717391304347,-0.0162717391304347,Negative,"{'neg': 0.286, 'neu': 0.496, 'pos': 0.218, 'compound': -0.7485}"
Aldi,shop aldi first time,dude even wf cheap publix buy brand publix control publix good bogos besides subs youre well shopping anywhere else yeah aldi acquire winndixie think theyre come publix grocery shopping world stratify really cheap outlet like aldi really expensive luxurious outlet like whole food im really sure much room publix long term middle happen last week lifelong publix shopper go aldis first time couldnt believe low price havent go publix since start aldi last publix trip give ptsd pay,2023-08-21 15:14:27,Neutral,0.0,Positive,0.0117620253164556,0.0117620253164556,Positive,"{'neg': 0.016, 'neu': 0.791, 'pos': 0.194, 'compound': 0.9292}"
Aldi,aldi sweet potato making uncomfortable,sense challenge come feel throb dicktater place put make uncomfortable love dick vein,2023-03-27 23:15:33,Positive,0.1027,Negative,-0.0073357142857142,-0.0073357142857142,Negative,"{'neg': 0.289, 'neu': 0.441, 'pos': 0.27, 'compound': -0.1027}"
Aldi,aldi give cashier seat use work mildly interest,supermarket chair cashier live wait saw post early didnt catch supermarket usa weird man seriously couldnt sit pay minimum wage owe least uncomfortable hour day get rule free time case need also boss get go bathroom freedom im get fuck tired typical countryman leave thread couple american proudly state american wealthy european american tvs european whole argument disagree statement original poster automatically think european laugh cope america successfully create multiple generation willfully misinform idiot cling country thread false sense superiority american exceptionalism rot go cause demise usa probably lifetime know scarcity start hit us seriously next year go lot confuse angry american nowhere lash except country wait thats common us supermarkets arent even allow oh allow drinking within work hour,2022-06-08 03:48:28,Positive,0.4588,Positive,0.0051107438016528,0.0051107438016528,Positive,"{'neg': 0.19, 'neu': 0.614, 'pos': 0.196, 'compound': 0.6184}"
Aldi,aldi advertising right,oh wow aldi clever way get tell use song lyric well right side dont pay writersartist general enough law wooah halfway wooah unwaxed lemon take ham well bake sweaaar delete,2018-04-30 16:34:47,Neutral,0.0,Positive,0.0284935483870967,0.0284935483870967,Positive,"{'neg': 0.0, 'neu': 0.67, 'pos': 0.33, 'compound': 0.8833}"
Aldi,mozzarella vom aldi g anstatt g,da kommt davon da du ne lidl waage genommen hast auf ner aldi waage htte e bestimmt g angezeigt schreib aldi du hast anrecht auf erstattung auerdem sind die verpflichtet dem nachzugehen die mengenangaben drfen keinem fall unterschritten werden kauf noch davon und meld dich dann beim verbraucherschutz bann die weg man wird nicht zu unrecht allman genannt frage die runde macht ihr eigentlich mit dieser weien kugel nachdem ihr den mozzarella getrunken habt da wasser zhlt nicht zum gesamt gewicht,2023-09-28 18:30:50,Neutral,0.0,Negative,-0.0115670731707317,-0.0115670731707317,Negative,"{'neg': 0.172, 'neu': 0.828, 'pos': 0.0, 'compound': -0.9485}"
Aldi,aldi pasta sauce jar measurements sticker,many sauce jar especially square one cabinet full mason jar like love reuse also nice motivation make pickle homemade sauce give gift without go buy specific mason jar would nice manufacturer could think packaging might reuse put impossibletoremove sticker would fine start always get pasta sauce aldi measurement find delete classico jar really good sauce wait sale,2020-06-22 22:53:07,Neutral,0.0,Positive,0.0166637931034482,0.0166637931034482,Positive,"{'neg': 0.0, 'neu': 0.684, 'pos': 0.316, 'compound': 0.9665}"
Aldi,aldi buy winndixie harvey grocery southern us,interest footprint generally small wonder transition happen aldi crazy term price compare everyone else dramatically cheap streamline one brand thing generic get thing would cost x much publixvonsalbertsons sometimes hope sends aldi pup top winndixie aldi kick take name low price save america high food cost dang winndixie thats name havent heard long time leave texas around fully forget,2023-08-17 12:17:44,Neutral,0.0,Positive,0.0102216666666666,0.0102216666666666,Positive,"{'neg': 0.115, 'neu': 0.727, 'pos': 0.158, 'compound': 0.6133}"
Aldi,aldi nord v aldi sd partition world,make seem like aldi nord aldi sd find germany thats case great aldi equator brother split company dispute whether sell cigarette karl believe would attract shoplifter brother time jointly shop cash flow dm million yearly introduce name aldishort albrechtdiskont translate english albrecht discount aldi nord aldi sd financially legally separate since third world war fight aldi nord aldi sd nation treaty aldisillas map couldve make effort simply show german partition fairy north south,2023-10-09 19:52:33,Neutral,0.0,Positive,0.0010432432432432,0.0010432432432432,Positive,"{'neg': 0.107, 'neu': 0.77, 'pos': 0.123, 'compound': 0.0772}"
Aldi,one bad experience aldi wagie,remove remove removed please tell stole beer pork chop remove,2022-04-13 10:48:40,Negative,-0.5423,Positive,0.0289272727272727,0.0289272727272727,Positive,"{'neg': 0.0, 'neu': 0.796, 'pos': 0.204, 'compound': 0.3182}"
Aldi,start shopping aldi,dont rush till anymore tell us slow thats pretty clever major cop lot shit selfserve camera privacy etc moment nice relaxed thcentury checkout experience good way keep people happy ive always enjoy catch die approach bag stuff aldi ive pretty much decide exclusively shop local aldi watch grocery bill jump week definitely dont carry everything get need supplement speciality stuff elsewhere wish aldi let shop online near one min drive dont access car local aldi mermaid water selfserve checkout ive start go thing never bother rushrush good move aldi,2023-08-22 03:34:31,Neutral,0.0,Positive,0.0108633333333333,0.0108633333333333,Positive,"{'neg': 0.064, 'neu': 0.635, 'pos': 0.301, 'compound': 0.9777}"
Aldi,expose busy aldi,extra brave cos get lidl one good job man let work title hmmmm unexpected item baggage area come title find nice heartwarming situation wear dirty mac next time well well unexpectedly wholesome,2023-01-19 17:39:24,Negative,-0.1531,Positive,0.0275757575757575,0.0275757575757575,Positive,"{'neg': 0.065, 'neu': 0.564, 'pos': 0.37, 'compound': 0.91}"
Aldi,aldi recruit applies aldi youre successful go aldi store see recruit poster applies aldi sorry look like youve already apply role also aldi nobody want work anymore,never understood make candidate wait period time apply stupid rule role apply though id imagine lot role struggle fill wouldnt massively picky similar experience sure theyre list job data mine first tempt ask expect apply fail tried soon ask accept norm sure dont want someone apply short time period company month cool period interview hour fail interview tell well try year company really want hire great people let person try interview cant fill position month hire treat like game sometimes rigid rule rule always tilt candidate least also hurt company someone promise come close cant fill role month ill hire manger struggle oh career website joke give,2023-03-03 15:42:46,Positive,0.743,Positive,0.0012314814814814,0.0012314814814814,Positive,"{'neg': 0.182, 'neu': 0.631, 'pos': 0.186, 'compound': 0.133}"
