Category,Title,Top Comments,Post Date and Time,Title Sentiment,Title Compound,Top Comments Sentiment,Top Comments Compound,Weighted Comment Compound,Sentiment,Comment Sentiment
Coles,cole pr work overtime,omg turn comment instragram story get roast delete healthy nutritious think point fee family meal eat junk food sead,2023-09-12 00:43:11,Neutral,0.0,Positive,0.020095,0.020095,Positive,"{'neg': 0.0, 'neu': 0.87, 'pos': 0.13, 'compound': 0.4019}"
Coles,cole price vs,big hug beetroot brother tough one sec lem check something ya go australian supermarket chain cole report total sale revenue abn bn continue operation first half h fiscal fy figure represent increase period fiscal fy week january retailer gross retail sale continue operation abn year earlier sale revenue continue discontinue operation grow abn cole earnings interest tax depreciation amortisation ebitda increase h earnings interest tax ebit continue operation rise net profit tax continue operation prioryear period still screenshots catalogue phone difference pricing crazy ill always remember toilet paper price massive increase one go lady heart go back checked price online order think literally lose mind price difference escalation crazy certainly beyond inflation greed fine disclaimer love data cant use excel look item family havent personally order cole show order back october nothing im basic girl basic skill good intention also know comment like bad elsewhere surprising thats okay share also size product shrinkflation theyve advertise anyway,2023-08-19 01:48:48,Neutral,0.0,Positive,0.0058815286624203,0.0058815286624203,Positive,"{'neg': 0.123, 'neu': 0.675, 'pos': 0.202, 'compound': 0.9234}"
Coles,g aint g day dodgy cole,guess go newscomau tomorrow wring meat tampon e estimation packaging guess weight im pretty sure meme tweet uk basically thing reply something like youre buying ground beef heroin support local butcher itll weigh front youll pay,2022-11-10 08:56:41,Positive,0.1695,Positive,0.0196459459459459,0.0196459459459459,Positive,"{'neg': 0.104, 'neu': 0.655, 'pos': 0.242, 'compound': 0.7269}"
Coles,woolies cole strike th,show folk support avoid shopping time union ask customer boycott something youve personally decide add post ask strike often rely consumer demand continue even staff go add pressure company find solution swiftly particularly case worker cross picket line work anyway dont boycott strike go weekly shop add pressure nearly coles year back casual condition shit due management rinse everyone enough resource believe full time rate considerably less glad get damn robot uprise didnt know self service machine could strike shop farmer market,2023-10-01 09:59:24,Negative,-0.128,Negative,-0.0096963855421686,-0.0096963855421686,Negative,"{'neg': 0.23, 'neu': 0.652, 'pos': 0.118, 'compound': -0.8048}"
Coles,cole anti theft measure get bit wild,store test new technology coles get everything first pass test theyll eventually roll footscray decade adaptive protip wan na shoplift cole byo trolley ai ice age tech call sensor year canada way work trolly pass magnetic loop enter store usually thru gate arm trolly stop device trolly pass thru manual checkout lane stop infront self checkout disarms stop device slow speed stop purpose device stop people load trolly full merchandise run door ether go entrance gate cut thru self check heard theyre trialling trap door crocodile bottom hampton park cole im death laser advocate though,2023-08-06 21:25:45,Negative,-0.3182,Negative,-0.0098541666666666,-0.0098541666666666,Negative,"{'neg': 0.182, 'neu': 0.818, 'pos': 0.0, 'compound': -0.946}"
Coles,ok woolies coles fair warn future shopping visit,post mark nonpolitical please respect keep discussion topic devoid political material bot action perform automatically please contact moderator subredditmessagecomposetoraustralia question concern way company treat staff equally horrendous husband department manager desperate need staff complete insane amount task thats require run store properly time upper management flatout refuse hire team member hit department target allot wage hire team member hit target one man physically achieve amount work want within set time frame regularly hr shift day week get everything complete skeketonteam zero overtime pay consistently exhaust overworked frustrate sore downtrodden im help look work elsewhere company chewup spit anyone foolish enough stick work hard yeah fuck em think im local cole remove half checkout mind always close im aldi every week get much possible local iga fruit shop butcher bit hassle cheap good quality stuff think everytime go shop like intentionally create hostile environment also forget people stack shelf block every isle pm sure wont pay people overnight wage occasional theft cheap three four hour shift theyll keep cut staff replace self service machine,2023-08-23 06:12:28,Positive,0.4767,Negative,-0.0049568965517241,-0.0049568965517241,Negative,"{'neg': 0.181, 'neu': 0.694, 'pos': 0.125, 'compound': -0.8625}"
Coles,people tassie enough colesworth,year ago economist interview abc explain big two percent market wouldnt tolerate country thing aldi tasmania everyone talk theyre switch shopping aldi tassie cant even want go supermarket option super expensive iga expensive colesworths im live mainland friend send photo shop say thing like one bag suck dont option go aldi like also launnie chitchat page distribute label typo free see every store templates please gladly hit local good shit hijack marketing campaign force rebrand cost hundred million literally way get message across point edit get permanently ban subreddit comment lol,2023-09-01 20:36:50,Neutral,0.0,Positive,0.0100619565217391,0.0100619565217391,Positive,"{'neg': 0.098, 'neu': 0.678, 'pos': 0.224, 'compound': 0.9257}"
Coles,saw two people walk cole worth stuff,assume cole monthly executive meeting look like theft still project total revenue something keep eye margaret back leave give us update wilson security contract task force get overpaid one monopoly hound back feel like good time ever turn life petty crime ive two house break ins year one car break cop never damn thing last time house get broken told probably wouldnt catch anyone go downhill car go k theyd quick could break house day live best life cole recently send memo team tell us try stop thief risk fire cant anything anymore thief know get brazen everyday cole security year ago would also walk us car night amaze sometimes park decent walk away feel like big difference someone flog cheap loaf bread value pack cheap snag make sure kid fedand go around pick premium food deli meat clean beauty product etc rack hundred thousand,2023-05-15 09:37:09,Positive,0.2263,Positive,0.0063184931506849,0.0063184931506849,Positive,"{'neg': 0.127, 'neu': 0.672, 'pos': 0.2, 'compound': 0.9225}"
Coles,cole woolworth worker go strike first time history saturday local time,fuck get essential worker keep work right throughout pandemic risk daily abuse stress public yet pay fuck get watch coleswoolworths implement self checkout take pay work away doubt add stress friction customer people literally put charge national toilet paper ration week least throw dollar hour great hope get movement corp good use work cole disgust little pay refuse pay anyone high duty leave new job covid happen cant even imagine awful since positive change hopefully spur worker leave sda join raffwu give sda shithouse help protect business raffwu come nowhere year ago upstage sda number case honestly strike longer,2023-10-04 02:04:48,Negative,-0.128,Negative,-0.003053,-0.003053,Negative,"{'neg': 0.264, 'neu': 0.517, 'pos': 0.219, 'compound': -0.3053}"
Coles,please explain cole,know gluten glutenfree product serving per pack like person sit eat whole chicken say hi seven news online reporter whos steal picture sorry youre work sunday nice article youve provocative clickbait lately editor newsc omau lifestyle editor know headline supermarket identical anyway hope get real job soon apply abc sb cadetship hurry schrodinger gluten gluten free apart wheat flour coeliac read panel ingredient rule let say coeliac option cook chook would complete game changer true gf fast food option near sometimes girl want convenience food id give cook chookbut instead go back bbq im use still crave fast food option,2022-10-16 01:15:39,Positive,0.3182,Positive,0.0086920792079207,0.0086920792079207,Positive,"{'neg': 0.04, 'neu': 0.821, 'pos': 0.139, 'compound': 0.8779}"
Coles,cole finally trash local supermarket,aldi start roll self checkout take advantage free item thing though return self scan mum say turn complain colesworth subreddit today prefers thing cause mean avoid talk people mean like hard use anything dog still god love lmao,2023-08-27 06:23:47,Neutral,0.0,Positive,0.0235102564102564,0.0235102564102564,Positive,"{'neg': 0.115, 'neu': 0.546, 'pos': 0.339, 'compound': 0.9169}"
Coles,someone add local cole woolworth signage,love hold tool wear hi vis nobody blink eye country someone wasnt say chaser level protest vibe love beautiful quality protest tom inevitably get fine please put gofundme reddit donate cover part cost thanks something people,2023-09-01 02:08:43,Neutral,0.0,Positive,0.0255675675675675,0.0255675675675675,Positive,"{'neg': 0.078, 'neu': 0.546, 'pos': 0.376, 'compound': 0.946}"
Coles,cole undercover security np,post mark nonpolitical please respect keep discussion topic devoid political material bot action perform automatically please contact moderator subredditmessagecomposetoraustralia question concern hate guy ever get asked dont go want look bag dont let must permission look theyre also allow force produce id decline ask choice either involve police let go risk may tell youre allow come store anymore deal think cant easily enforce anyway nothing lose cole lpos story quite strange happen write never see take someone back office without confirm steal thing normally issue ban notice notify police would largeopportunistic theft take photo record people detail database never never someone didnt steal theft take place never get point since recordkeeping happens theft confirm genuine story would push cole head office liaise storethese lpos kind behaviour egregious experience completely unfathomable really never see lpos act manner ill post people dont believe happen something similar happen another state cole terrify two stranger plain clothes ask go private area melt terror middle store throw bags floor make check way go second location two people hadnt show id quiet frankly look like career criminal make scene get store manager profusely apologise half hour go spoke aggressive two security staff truly frightening experience think need refer police people allow detain someone even police cant act willingly go need know cole standard delete,2023-04-20 14:30:15,Positive,0.5859,Negative,-0.0016844748858447,-0.0016844748858447,Negative,"{'neg': 0.135, 'neu': 0.732, 'pos': 0.133, 'compound': -0.3689}"
Coles,cole sandwich joke,one thing miss uk good supermarket sandwich wish didnt ethos shop rip people every opportunity put social eleven get voucher look like food serve fyre festival seem pretty standard shitty takeaway sandwich,2021-09-23 06:45:11,Positive,0.296,Positive,0.0273393939393939,0.0273393939393939,Positive,"{'neg': 0.112, 'neu': 0.516, 'pos': 0.372, 'compound': 0.9022}"
Coles,get back month overseas fuck cole,post mark nonpolitical please respect keep discussion topic devoid political material bot action perform automatically please contact moderator subredditmessagecomposetoraustralia question concern best mate work woolies minus eftpos outage cole morning many issue self serve checkout yes staff hate much customer coles national eftpos outage morning pandemonium local store still manage get fairly quick whats amaze story manage get six item get flag unscanned item idly hold phone far scanner stand arm side like fuck robot second transaction doesnt turn minute wait,2023-09-23 01:12:39,Negative,-0.5423,Positive,0.0110743902439024,0.0110743902439024,Positive,"{'neg': 0.072, 'neu': 0.721, 'pos': 0.206, 'compound': 0.9081}"
Coles,cole manipulative dodgy pricing,post mark nonpolitical please respect keep discussion topic devoid political material bot action perform automatically please contact moderator subredditmessagecomposetoraustralia question concern industry standard unfortunately cant rely sale price honesty accc obviously protocol since actually give answer seem like want supermarket least pretend honest cole push price stay isnt really work catch phrase anymore ethic keep chase im sick see b everywhere turn cynic,2022-09-06 01:41:34,Negative,-0.2263,Positive,0.01325,0.01325,Positive,"{'neg': 0.103, 'neu': 0.651, 'pos': 0.246, 'compound': 0.848}"
Coles,cole drink chocolate upscale supermarket malaysia,haha australian way home brand cole land sydney morning short holiday malaysia nepal saw woolies brand roll oat homebrand soft drink genuinely surprise many australian product homebrand soft drink expensive bottle coca cola end buy usual bulla ice cream bega cheese etc theyre everywhere asian country use see vietnamese supermarket kid visit family one year decade ago brought cadbury drinking chocolate gift grandfather container explode checked luggage arrive day late lose transit singapore pro tip literally two ingredient cocoa sugar nothing else make fraction cost could probably anywhere earth expensive stuff usually cocoa sugar feel free use ratio like welcome homebrand product ive see sold premium overseas barebones product australians eg cole milk see good quality product overseas particularly asia last time visit hong kong also small grocer advertise cole brand food,2023-08-08 12:05:49,Neutral,0.0,Positive,0.0071917293233082,0.0071917293233082,Positive,"{'neg': 0.018, 'neu': 0.831, 'pos': 0.151, 'compound': 0.9565}"
Coles,meat check coles self checkout,cole fella come say scan meat bulky item heres idea cole dont guy stay scan item way youll sure didnt steal stuff could even give job title reckon something like checkout operator might fit bill self checkouts become even inconvenient slow disjoint traditional checkout cole shit bag hire enough staff lot meat local rfid tag need deactivate go woolies self serve yesterday scan item place correctly bag camera wasnt convince attendant obviously overwhelmed register issue take age get delete,2023-09-03 02:25:54,Neutral,0.0,Positive,0.0042175,0.0042175,Positive,"{'neg': 0.086, 'neu': 0.79, 'pos': 0.124, 'compound': 0.3374}"
Coles,king melb central cole express today,delete say couldnt gotten grocery yet thats literally checkout receipt show shop airpods try stop way look blankly start walk security guard power pull give attitude like guy walk cant open bag pressure voluntary search say im detain back cant search without arrest theft otherwise illegal search false imprisonment fuck cole im go go steal chick pea right kmarts put type person front entrance zoomer girl couldnt give shit stole look like dont want uptight middle age shedwight many life frustration project ive never shoplift cunt security guard would definitely gaslight enough think ive steal good person leave,2023-09-06 07:05:38,Neutral,0.0,Negative,-0.0019565656565656,-0.0019565656565656,Negative,"{'neg': 0.2, 'neu': 0.606, 'pos': 0.194, 'compound': -0.1937}"
Coles,cole price halfprice anymore,link newscomau love increase regular price item sell old regular price pretend discount half price list gradually shrink since covid specially compare woolies think profiteer midst others misfortune meanwhile iga improve carry black gold product colesworth seem drop tomato even romas last visit box favourites woolies today half price fuck pay box favourite forget mark price discounting,2023-03-19 05:57:18,Neutral,0.0,Positive,0.0075931034482758,0.0075931034482758,Positive,"{'neg': 0.148, 'neu': 0.691, 'pos': 0.161, 'compound': 0.4404}"
Coles,new cole basket shiiiiiiit,one telescopic drag handle even bad absolute fuck shite agree big size half structural integrity double handle soon put kg shitty handle start bed flex wonder old one theyre shit drive woolies get grocery rather go around corner cole swear people would get annoyed theyll use trolley buy awkward every sense word comfortable way hold sent email tell get standard pas response,2023-06-27 01:15:07,Neutral,0.0,Negative,-0.0143206349206349,-0.0143206349206349,Negative,"{'neg': 0.266, 'neu': 0.63, 'pos': 0.104, 'compound': -0.9022}"
Coles,excellent saving cole,kid put wrong markdown label someone else get rump much cheap hi newscomau im constantly surprise sub seemly endless appetite price label photos slap fuck knee cackle x great everyday thousand supermarket worker label hundred thousand product across australia thousand lucky bastard whove never work retail life baulk injustice comedy single isolate label error post reddit equivalent bore group chat one include law high profit margin least quarter hey input costinflation problem consider take service desk would get free yes pretty fuck good saving,2022-12-13 08:35:19,Positive,0.5719,Positive,0.0018011764705882,0.0018011764705882,Positive,"{'neg': 0.223, 'neu': 0.54, 'pos': 0.237, 'compound': 0.1531}"
Coles,cole profiteer also cole,illegal put herbs much plastic tip asian grocery freeze lemongrass stalk buy lemon grass plant youll never buy definitely need two people dont realise lemongrass grows like psychotic weed plant pot youll never buy ever,2023-09-01 09:00:53,Positive,0.2023,Negative,-0.0135194444444444,-0.0135194444444444,Negative,"{'neg': 0.144, 'neu': 0.764, 'pos': 0.091, 'compound': -0.4867}"
Coles,solution woolworth cole spy check camera,wish didnt humble bad see face screen flatter angle man dont care film fuck hate see face checkout screen dont know happen pic yes know camera everywhere gripe wait staff member also deal checkout click button say im steal shit something trolley bag floor hand sweep past scanner swipe card think im pretend scan something hurdigur photo anyway hal scan item im sorry dave im afraid cant,2023-08-31 01:00:26,Positive,0.3182,Neutral,-0.000485294117647,-0.000485294117647,Neutral,"{'neg': 0.183, 'neu': 0.636, 'pos': 0.181, 'compound': -0.033}"
Coles,math hard cole,today op learn buy one get one free deal dont see incorrect math except c round grape whenever see sort weird anomoly pricing ticket like put item trolley see scan scan different price get item free side comment didnt blueberry use gram pack get bloatflation one stage misremembering,2023-09-22 12:53:43,Negative,-0.1027,Positive,0.0165836734693877,0.0165836734693877,Positive,"{'neg': 0.032, 'neu': 0.799, 'pos': 0.169, 'compound': 0.8126}"
Coles,cole market,way avoidable voting wallet although bet dont notice put price slaps low price tag shelf fuck anyone gon na gram ham eat gram whilst make fuck sandwich aldi end year refuse shop woolworth cole food system shouldnt shareholder profit package size change june supermarket friend mention day think g version year ago dont remember anyone else remember would year ago,2023-07-10 01:07:22,Neutral,0.0,Negative,-0.0140868852459016,-0.0140868852459016,Negative,"{'neg': 0.196, 'neu': 0.758, 'pos': 0.046, 'compound': -0.8593}"
Coles,tried cole shop via uber eats dont,wow system even work design utter rubbish believe business think way efficient ok also bet driver adequately compensate park learn store layout find food substitute queue register get bag finally deliver uber rely customer tip really dont want virtual shopping experience realtime uber youre insane put complaint uber get refund fault system suck shouldnt penalise youre way apologetic screwup ubers business model hello op nothing add thread read lot comment reason stand incredibly polite kind person hope work uber credit refund dont hard proud try something new share experience wise caution others keep legend delete,2023-07-08 10:18:30,Neutral,0.0,Positive,0.0082781249999999,0.0082781249999999,Positive,"{'neg': 0.146, 'neu': 0.649, 'pos': 0.204, 'compound': 0.7947}"
Coles,turn cole,sa suburb call ingle farm shopping centre cole bilo cole buy bilo bilo become cole shop centre relatively small mind cole year remembers franklins one local iga car park signage recently fell result expose old bilo logo paint wall quite cool sight huey spokesperson love first real job bilo hour stack shelf,2022-12-27 11:56:04,Neutral,0.0,Positive,0.0138603773584905,0.0138603773584905,Positive,"{'neg': 0.028, 'neu': 0.854, 'pos': 0.118, 'compound': 0.7346}"
Coles,cole bipolar comment,want ask user refrain armchair diagnose contestant rumor harmful weve see small glimpse life much edit bot action perform automatically please contact moderator subredditmessagecomposetorloveisblindonnetflix question concern agree dont know one medicine something maybe anxiety depression felt like dig relate longer convo maybe one parent mental illness felt personal comment way look reaction didnt blame walk catch talk say neither fault smh seem adamant prove marry arent really take time figure want married feel like want person definitively say dont want marry weird comment way really fucking ignorant people mental health struggle throw someones face like insult mention say would say yes wed day prior seem forget think say mean thing get reaction forgets even say person get upset like get strange lol,2022-11-02 22:19:23,Neutral,0.0,Positive,0.0055373983739837,0.0055373983739837,Positive,"{'neg': 0.148, 'neu': 0.634, 'pos': 0.218, 'compound': 0.6811}"
Coles,happen cole,start august drop start october realised month move fuck stock overprice garbage could least calamari around time get strange thing pizzas didnt even eat show child wrong,2023-10-08 20:59:51,Neutral,0.0,Negative,-0.0306821428571428,-0.0306821428571428,Negative,"{'neg': 0.313, 'neu': 0.687, 'pos': 0.0, 'compound': -0.8591}"
Coles,anyone feel cole get exorbitantly expensive,post mark nonpolitical please respect keep discussion topic devoid political material bot action perform automatically please contact moderator subredditmessagecomposetoraustralia question concern tub western star aldi version kg block cheese similar difference theyre take piss honestly isnt expensive nowadays im sure area base stop buy fresh food coleswoolies entirely get household item literally cheaper buy fresh food local grocer butcher even harrisfarm much good quality yep definitely ive recently start shop aldi difference spend aldi v coleswoolies insane come two bags grocery coles woolies price price aldi get whole fkn trolley full good think also misconception aldi cheap knock offs poor quality food experience good better lot expensive brand name alternative,2023-08-11 08:30:43,Neutral,0.0,Positive,0.0086054054054054,0.0086054054054054,Positive,"{'neg': 0.098, 'neu': 0.656, 'pos': 0.246, 'compound': 0.9552}"
Coles,cole extort employee compulsory donation,surely cant legal id call union ombudsman unaustralian give newscomau quote reddit user inevitable story put buck bad grammar jar delete thank cooperation thanks choice asshole,2018-07-26 01:16:51,Neutral,0.0,Positive,0.0196851851851851,0.0196851851851851,Positive,"{'neg': 0.143, 'neu': 0.615, 'pos': 0.243, 'compound': 0.5315}"
Coles,zays take cole preference,quit discourse get messy im go lol want play safe pick white woman would stay away someone name zanab make race issue tire really dumbing issue guy even tried sort logistics could meet whole family shoot idea one another zanab perpetual victim show shes also professional victim spends whole life empty miserable hope cole find someone spectacular love bad guy think show change well also give raven shes biracial woman zanab zanab completely twist cole word action victim youre say exactly cole explain zanab wellaware wasnt white lily put propose really strong emotional connection want obviously fell deeply love thats heartbroken wed find funny despite cole also say find raven therefore hotter zanab ever focus rating colleen try say attract white girl revisionist history hilarious,2022-11-12 14:47:46,Neutral,0.0,Positive,0.0070738095238095,0.0070738095238095,Positive,"{'neg': 0.158, 'neu': 0.613, 'pos': 0.229, 'compound': 0.8913}"
Coles,psa low stock level woolworth cole,mean year old girl stacking tin bake bean dusty shelf south melbourne doesnt control countrywide stock level australias two big supermarket im shock shock even ordinary time dont abuse staff anywhere simple good manner anyone take frustartion staff stupid understand real reason begin let alone willing accept quit job liquor store attach one main supermarket abusive customer wear idea im suppose take sworn spoken like idiot threaten maintain smile polite joke small woman feel like copped much abuse large male coworkers recently get abused year old man restock pack cruiser fridge purchase drove way home realise wasnt ice cold drove way back yell tell prerefrigerated put refrigerator could stick freezer minute come back let know fkwit ill never work retail edit spell remember last shortage grab variety item realise limit two total two particular thing poor kid come tell couldnt practically shake boot im asshole im go follow rule make problem someone whos try job apologise clarified instruction take extra item back make think many asshole yell person day many people complete fuckhead take frustration minimum wage kid authority boss told probably yell dont nice staff tough time theyre cop shit dont add,2022-01-19 01:45:04,Negative,-0.2732,Negative,-0.004991237113402,-0.004991237113402,Negative,"{'neg': 0.198, 'neu': 0.683, 'pos': 0.119, 'compound': -0.9683}"
