Woolworths,woolworth behemoth charitable contribution,post mark nonpolitical please respect keep discussion topic devoid political material bot action perform automatically please contact moderator subredditmessagecomposetoraustralia question concern get half reply one say theyre greedy cunt make much easy model verify say every dollar customer give match pretty crafty company turn million profit also notice new technology self serve notice youre try scan banana example screen give option lady finger banana go search plain old banana alphabetically ive noticed item always expensive item first available try buy online want buy woolies item arent available left far expensive brand name item happen week give go store anyway low behold cheap available item fully stock see comment come least week ozharvest partnership woollies many year donate half food ozharvest distribute weekly op shopssoup kitchens community support organisation dont care two fig woollies company anyone work community service know important ozharvest much woollies food get pass woollies donate top huge food donation theres take donation charity back woollies amaze opportunity,2022-12-22 11:57:40,Positive,0.4019,Positive,0.0060254658385093,0.0060254658385093,Positive,"{'neg': 0.054, 'neu': 0.756, 'pos': 0.19, 'compound': 0.9701}"
Woolworths,woolworths shopper hit back backlash exclusive move,whats wrong dont feel comfortable swap data personal shopping habit half assed deal toilet paper delete wouldnt fuck label require non member price least prominent member pricing look like theyve get small font someone time hand go make complaint reprint stupid label genuine question negative impact track shop habit oh special direct product normally buy anyway oh dam voucher spend money im go spend anyway oh discount price wait reddit find every store country give deal buy thing app need start watch aca weekly save x dollar segment get ahead next thing everyone angry,2023-09-04 23:22:50,Positive,0.128,Negative,-0.0074821052631578,-0.0074821052631578,Negative,"{'neg': 0.176, 'neu': 0.699, 'pos': 0.125, 'compound': -0.7108}"
Woolworths,whoever take wallet glenhuntly woolworth,look around carpark sort seclude spot around shop high chance immediately open cash etc take chucked check rubbish bin late find mine bin theyd take cash throw wallet sorry happen really hope get back terrible try ptv lose find mightve discard tramtrain happen tonight id check bin safely best wish shop woolies think steal woolworth perhaps make police complaint hopefully woolworths check camera emailcontact store manager,2023-09-04 12:06:39,Neutral,0.0,Positive,0.0099955223880597,0.0099955223880597,Positive,"{'neg': 0.168, 'neu': 0.624, 'pos': 0.208, 'compound': 0.6697}"
Woolworths,australian supermarket woolworth quiet hour music sensory need,use netherlands old people think stop due lack interest aldi never music day year delete favorite part norway music radio nothing shop amaze super neat raise question due personal experience old kid issue noise grocery store music far least problem wonder many people find helpful never bad thing try make curious,2023-04-25 06:40:59,Neutral,0.0,Positive,0.0159173076923076,0.0159173076923076,Positive,"{'neg': 0.151, 'neu': 0.574, 'pos': 0.276, 'compound': 0.8277}"
Woolworths,woolworth supply meat,system admin woolworths distribution way system work everything put automatic order process buy something automatically send warehouse pick next truck order warehouse didnt stock item put back order type category problem system never really used way system work never stock warehouse scale order evenly distribute much store back order still werent get need sent evenly stock could look like week worth meat one truck pick operation manager although order could peek time miss picker also know picking trays meat much really one fault meat price huge discount dont expect every woolies fix im wait car forget house aint never gon na happen need find woman deny sausage week ago im meat eater think waste meat kill life take meat get thrown kill animal nothing much bad food wastage kmart today clothe trolley back along back mens section towards storage room door mostly clothe couldnt get lot thing want look,2022-02-19 07:53:12,Neutral,0.0,Negative,-0.0062106666666666,-0.0062106666666666,Negative,"{'neg': 0.139, 'neu': 0.797, 'pos': 0.064, 'compound': -0.9316}"
Woolworths,backlash cole woolworths swirls social medium billiondollar profit cost living crisis,guarantee conversation around board room table go like next week fuel price rent col crisis ride circumstance situation improve customer despite outrage dont think reasonable today call duopoly weve get many player market professor mortimer id like counter point everyone live big city everyone aldi theres none nt near independent grocery minute away charge colesworth food market run saturday sunday run time id usually work theres quite number family company long lifevacuum seal good rural area might worth road trip month stock decent produceits obviously go replace weekly shop cash go straight vampric corporation happily let people start serve share holder good thing always seem nice advertising splurge always come financial report try get habbit shopping aldi iga instead,2023-09-07 20:46:04,Negative,-0.296,Positive,0.0081075,0.0081075,Positive,"{'neg': 0.029, 'neu': 0.742, 'pos': 0.229, 'compound': 0.9729}"
Woolworths,woolworth offer instore wtf,post mark nonpolitical please respect keep discussion topic devoid political material bot action perform automatically please contact moderator subredditmessagecomposetoraustralia question concern doesnt affect personally yet another decision theyve make past year prove woolworths folk unable shop store get feed im single parent car convenient unlimited delivery even though woolworths general expensive store always forget thing website make easy shop low high price much easy stick strict budget rather impulse buy cheap ingredient usually lurk bottom random shelf cant find shop kid asleep everything creep dont even want bag wish would take back use minimal time rather clog recycle bin think im back aldi budget weigh benefit work woolworths online customer hub honestly understand reason behind told reason behind due people use offer store honestly dont think true reckon main reason stop reduce amount interaction come customer hub id probably say least percent interaction deal usually involve discount completely disagree believe youre pay service entitle one month online instore also affect prefer shop online meaning longer use additional percent staff discount im entitle unless go store dont mean sound like everyday representative im dead honest please contact woolworths online feedback urge submit feedback come get enough negative feedback shit hopefully go back normal feel bad rural people cant go store move ridiculous im hoping go back go store youre likely impulse buy,2023-05-29 08:43:40,Negative,-0.5859,Positive,0.0018486486486486,0.0018486486486486,Positive,"{'neg': 0.134, 'neu': 0.73, 'pos': 0.137, 'compound': 0.4104}"
Woolworths,woolworth raise lower price,post mark nonpolitical please respect keep discussion topic devoid political material bot action perform automatically please contact moderator subredditmessagecomposetoraustralia question concern wait tell rug shop thats close wish law put tag shit increase price know one like look expensive go yep put pepsi basically theyve increased price overall pretending price drop shady fucker accc rule price set week drop claim save use accc doesnt give shit price week ago really blame pissweak consumer protection,2023-05-31 06:21:57,Negative,-0.296,Positive,0.0053773333333333,0.0053773333333333,Positive,"{'neg': 0.183, 'neu': 0.577, 'pos': 0.24, 'compound': 0.4033}"
Woolworths,find frog woolworth organic lettuce,put organic lettuce poor little thing hey newscomau put comment article well definitely organic pesticide guess legit least something green leafy rather box whizzo quality assortment yeah happen one time customer hand bag grape say massive spider sure fuckin massive spider huntsman blend perfectly bunchs stem,2023-03-23 11:21:43,Neutral,0.0,Positive,0.0194,0.0194,Positive,"{'neg': 0.053, 'neu': 0.663, 'pos': 0.284, 'compound': 0.9118}"
Woolworths,worker atop woolworth build new york,seriousness many people work like fell death fear height wasnt invent yet delete guy build take break readjust gopro get dope parkour channel try get ground nary safety device find,2020-03-26 10:12:14,Neutral,0.0,Negative,-0.0147999999999999,-0.0147999999999999,Negative,"{'neg': 0.215, 'neu': 0.648, 'pos': 0.137, 'compound': -0.4588}"
Woolworths,woolworth underpay worker million,get catch say sorry business strategy apparently people gon na get jailed sort offence fin sham company clearly hasnt worked work woolies three week ago nightfill department team meeting store manager basically tell time thief mean come back break minute dot extra toilet break chat etc night ago girl get sent home come back break minute late old lady whos department many issue pay keep forget pay public holiday rate sick day refuse work public holiday constantly chase week receive proper rate oh also told stock loss customer theft wouldnt high customer service well funny see article come morning company director put mask rob million dollar year bank ten year would put jail soon find worker get slap wrist theft employee take bosss money employee jail bos take employee money boss promote reducing cost increase profit,2019-10-29 22:07:20,Neutral,0.0,Negative,-0.0029335766423357,-0.0029335766423357,Negative,"{'neg': 0.159, 'neu': 0.704, 'pos': 0.137, 'compound': -0.4019}"
Woolworths,ketchup mustard sugar pour head college student sitin protest jackson woolworth store,photo father college time crazy really yesterday grand scheme thing year ago assholes picture late teen theyre late still property business vote human right museum atlanta deli counter sit put headphone hear kid would hear absolutely horrific cut soul immediately people couldnt even stand minute two young people absolute hero willingly endure right million others people scream dump thing head would still alive today need keep remember wasnt long ago always remember always keep fight still lot people america would like see go back never ahhh yes civil day american politics,2023-02-12 15:45:29,Negative,-0.25,Negative,-0.0096445652173913,-0.0096445652173913,Negative,"{'neg': 0.205, 'neu': 0.691, 'pos': 0.105, 'compound': -0.8873}"
Woolworths,whats likely outcomecharge get caught steal coleswoolworths,post mark nonpolitical please respect keep discussion topic devoid political material bot action perform automatically please contact moderator subredditmessagecomposetoraustralia question concern get spank one giant price foam hand actual woolies worker insight youll become known staff theyll collect cctv enough youll get officer door notice ban nobody store interact explicitly tell edit im also go note someone lot self serve time know exactly youre get eye really quickly theres quite us thatll care machine catch something reprimand likewise thatll want thrown scan bag pick target folk last recall boy stole piece bread put chain place boat far away island call australia someone mum know recently get caught steal cole mostly meat understand let go get cocky end hundred worth get arrested police walk store cuff feel like turn blind eye degree pure greed step,2023-10-03 05:06:33,Negative,-0.4939,Positive,0.0022977777777777,0.0022977777777777,Positive,"{'neg': 0.107, 'neu': 0.765, 'pos': 0.128, 'compound': 0.3102}"
Woolworths,would like politely request everyone boycott cole woolworths idiot say politely,post mark nonpolitical please respect keep discussion topic devoid political material bot action perform automatically please contact moderator subredditmessagecomposetoraustralia question concern ive switch aldi iga stuff aldi doesnt two store near woolworth cole ffs delete fuck im,2023-08-23 15:05:58,Negative,-0.4767,Negative,-0.004028947368421,-0.004028947368421,Negative,"{'neg': 0.155, 'neu': 0.681, 'pos': 0.164, 'compound': -0.1531}"
Woolworths,woolworth confirm new camera shelf,seem like kind thing would want track customer eye movement evaluate effectiveness shelf layouts possibly cut shoplift track stock way cant see invest money something doesnt make money way woolies pay cut staff unlike security camera instal throughout store woolworth confirm new mini camera use surveillance purpose look forward day walk back statement isnt barcode system suppose keep count stock sell doesnt work doesnt woolies staff look shelf notice get low camera single store go keep price low every single day keep get bad cancel everyday reward subscription delivery unlimited pay young kid hard fuck go shop fuck woolies,2023-06-09 08:40:49,Neutral,0.0,Negative,-0.008316,-0.008316,Negative,"{'neg': 0.207, 'neu': 0.684, 'pos': 0.11, 'compound': -0.8316}"
Woolworths,dairy frozen tin food cost rise cole woolworths ready announce fullyear profit,frozen tin use last bastion frugal frozen price increase particularly noticeable long cheap option ceo company aim announce record profit keep share price part remunerate share standard living cole audacity say theyre help keep cost living think theyre fool point bring profit woolworth fleece people,2023-08-21 22:02:06,Positive,0.6597,Positive,0.0192043478260869,0.0192043478260869,Positive,"{'neg': 0.052, 'neu': 0.677, 'pos': 0.271, 'compound': 0.8834}"
Woolworths,woolworth face criminal charge unpaid leave,trial next month fair enough late issue pick woolies themself internal audit theyve properly compensate affected employee nonetheless interest see result next month trial similar cole ping miss lsl entitlement owe worker good formerly exploit salaried staff member fuck guy bullshit policy oh want work hour hour shift please make sure clock rostered hour record hi time daily reminder job precarious try go home time could team injured please dont report look bad lost time injury stats oh want take time lieu sorry cant replace time oh time lieu expire need come day oh need staff many need way try impress regional manager take buck budget yeah fuck woollies also coles woolworth fresh fool peopleout entitle leave payment unfortunately type unprofessionalism lack accountability churn burn attitude deeply rooted culture industry turnover huge due low barrier entry easy sweep legit issue carpet plus internal process design obtuse difficult navigate employee say great see high profile example action take recent year need shine light much conglomerate mini hitler across various level management get away regular basis retail food hospitality supermarket industry need massive broom sweep anyone work woolworths cole tell even tip iceberg systemic intentional weird selfreported make wonder divert attention,2023-08-02 02:35:59,Negative,-0.5574,Negative,-0.001072,-0.001072,Negative,"{'neg': 0.168, 'neu': 0.679, 'pos': 0.152, 'compound': -0.2144}"
Woolworths,canberrans name bad woolworth shoplifter,assume dickson haha unrelated note woolies go defend current wage theft claim highpriced product target act supermarket shoplifter canberras woolworths supermarket chain high shoplift rate across country highpriced baby formula one steal item national capital supermarket high national average theft rate per store past month store record average million stolen item among hard hit woolies store dickson majura northern territory slightly supermarket canberra come second far low average store loss woolworth report million item steal across canberra store month cost multinational company million act store record average shoplifting loss nearly per month per store populous state victoria nsw record high unit loss spread across far great number store woolworths supermarket across nsw instance record combined loss million spread across state store supermarket shoplifter canberra specifically target baby formula store elsewhere country woolworth data reveal baby formula account worth formula steal per local woolies supermarket past month double victorias average store loss product average tin formula steal act store month period per week store act police woolworth store detective conduct number target operation across canberra past month work loss prevention officer lpos woolworth big w dan murphy coles member territory target team conduct plainclothes operation several shopping precinct june police lpos target shopping centre majura dickson operation three people arrest theft one offender also charge possess knife another breaching good behaviour order police also issue caution theft offence week later operation shift canberra centre two people arrest one theft breach bail six people issue caution theft detective inspector stephen ladd say operation timely reminder thief shoplift may seem like harmless offence still crime police continue target type offend add cost shoplifting add cost retail good police retailer continue work together address crime type operation expect say late woolworth data underscore concern raise analyst social researcher surge living cost grocery shelf price power bill mortgage drive crime woolworth cole ring twothirds australian grocery sale record rise theft rate year coles chief operate officer matt swindells say february company experience elevate theft invest staff train technology counteract however contact cole say corporate practice talk theft woolworth name bad price gouger play tiny violin willing bet jurisdiction thats city like many statistical ranking top bottom,2023-06-19 20:40:02,Negative,-0.5423,Negative,-0.0027270718232044,-0.0027270718232044,Negative,"{'neg': 0.155, 'neu': 0.777, 'pos': 0.069, 'compound': -0.9872}"
Woolworths,egg cream woolworth,johnny rocket use egg cream menu order one time swear break whole restaurant one know make eventually figure though ice cream place saw chocolate egg cream menu naturally order philistine use sprite instead seltzer water pukegif watch tutorial little old man proper way make egg cream pour syrup side glass didnt pool bottom seltzer doesnt get flatten try stir well til egg cream fact contain egg know go sound snobbish pedantic yes really truly genuinely foxs ubet please dont make egg cream hershey recipe two chocolate syrup noticably different cool see post response read several story character set nyc turn century kind family american girl rebecca series daughter really want try get ingredient yesterday go try tonight,2022-06-28 16:41:50,Neutral,0.0,Positive,0.0078457627118644,0.0078457627118644,Positive,"{'neg': 0.024, 'neu': 0.839, 'pos': 0.137, 'compound': 0.9258}"
Woolworths,woolworths worker train vr,im glad guy get state art training aco camera identify item child customer trolley quick instruct customer scan itemchild rather clear error get barcode child next free fruit raffwu member work ban moment strike action commence within current fortnight completely unprecedented woolworth thanks friendly relationship sda height covid mount customer abuse raffwu get us security guard sda give us badge put money mouth security guard cant shit pointless previous supervisor aint shit get violent personfor minimum wage job multi billion dollar company call cop,2023-09-27 12:46:43,Neutral,0.0,Positive,0.0111035294117647,0.0111035294117647,Positive,"{'neg': 0.108, 'neu': 0.63, 'pos': 0.262, 'compound': 0.9438}"
Woolworths,woolworth cole catch shoplifter stateoftheart technology,accc could catch price gouger state art technology ok steal abn almost like anticipate rise shoplifting though go keep raise price people unable afford eat im sure reduce breakage cost thechnologies bring mean price drop across board like reduce labour cost eradicate two human operate checkout one people buy ciggies one old people people infant herald golden age us stop go woolies put creepy webcam self checkout station cole go start never go either split shop aldi iga cost fuck two im gon na knock something cole woolies im gon na stop self checkout happy snap sort data mining reason security fuck em ironic jack price record profit level lead direct increase steal speak friend recall back everything go manned register accidental buying brown onion forgetfully leave expensive cleaning thing unscanned back trolley less tempting,2023-08-15 21:04:15,Neutral,0.0,Positive,0.0009676470588235,0.0009676470588235,Positive,"{'neg': 0.146, 'neu': 0.71, 'pos': 0.143, 'compound': 0.1316}"
Woolworths,woolworths post b profit amid covid outbreak supply shortage,greedy cunt get nerve put charity nag screen pay self serve price rise profit rise wage stay work woolworth dont give fuck staff make corporate window dress okay okay company work lower managerial role boast record profit bad time retail sector recent history mean like get profit gouging price set extraordinarily high mark ups every day item pass fair amount costing toward farmer grower supply stock exploit staff manipulate work less money often put position theyre unable take break perform role safely work hour initially rostered often hour hour unpaid overtime cut back work force make give shift staff give department despite trading busier ever manipulate medium maintain corporate image amid scandle scandle would see company similar standing penalise legally court public opinion nope like good business good business seem meanwhile service get bad besides price gouge supply issue still plague local woolies load stuff still miss shelf every time go different stuff every time,2022-08-24 23:40:27,Positive,0.2263,Positive,0.0023660256410256,0.0023660256410256,Positive,"{'neg': 0.15, 'neu': 0.691, 'pos': 0.159, 'compound': 0.3691}"
Woolworths,woman freak woolworth,delete audacity wan na pay get catch stay woolworth alien wont talk us raise hand youre agreement retail worker dont get pay enough,2020-12-06 01:39:55,Negative,-0.4404,Positive,0.0283666666666666,0.0283666666666666,Positive,"{'neg': 0.099, 'neu': 0.674, 'pos': 0.227, 'compound': 0.6808}"
Woolworths,another day darwin woolworth,think say say point feeding journalist anymore wisdom comment lock want condemn kind thing future call offer grand solution go ahead mature manner quite people comment consider one warn racism security guard come work bus stop notify happen member public come expect something bad tell guard hurt nothing compare deal bus let everyone know uncle arrest hour later assault female tps call male leave cop come everyday event see day day one come till late im hassle indigenous workmate cousin cause shit town write theyd give shit bunch moris holy shit bloke come tried trash shop work long incident assault random lady street trip hit head road jumped decide try stab lady pen pocket heap friendly chap need give real education start need stop call racism government decide step make change place embarrass many white australian call government try help community say control even sadder medium use footage dark fella something unjust get eye site,2023-01-30 06:59:23,Neutral,0.0,Negative,-0.006326282051282,-0.006326282051282,Negative,"{'neg': 0.278, 'neu': 0.606, 'pos': 0.117, 'compound': -0.9869}"
Woolworths,still least one woolworths sydney sport old logo branding eastwood,itll always eastwood detective work base photo able determine eastwood store small directional sign roof mention rutledge street exit pretty proud notice eastwood mention title fml nostalgic wish still franklins also self service woolies woolworths never bother updating eastwood store shopping centre resides suppose knock downrenovated around theyve leave long consent develop lapse,2022-06-03 12:04:31,Neutral,0.0,Positive,0.0165592592592592,0.0165592592592592,Positive,"{'neg': 0.02, 'neu': 0.769, 'pos': 0.212, 'compound': 0.8942}"
Woolworths,kauimpfstoff und bonbon gegen covid au woolworth,hab mir mal da datenblatt durchgelesen und da steht um die wirksamkeit von covidbon zu testen wurde eine fallreihe einer akkreditierten deutschen forschungseinrichtung durchgefhrt unter kontrollierten bedingungen wurde die ausatemluft vor und nach dem lutschen von covidbon ber einen zeitraum von drei stunden auf die covidviruslast untersucht bei allen patienten sank die viruslast signifikant und durchschnittlich innerhalb der ersten stunde nach kauen um prozent bei einigen teilnehmern war zudem zu verschiedenen messzeitpunkten keine viruslast nachweisbar insgesamt hielt die wirkung knapp zwei stunden najaa zutaten natrliche therische le zimt pfefferminz zitrone und extrakte ginseng quercetin ingwer weizenkeim isomalt xylit succralose mikrotristalline cellulose silicumdioxid zink ne klar mir gefllt besten stark gegen mutationen da verringert die viruslast im umkehrschluss dann gilt da fr leute die bereits krank sind wre mir lieber wenn die zuhause bleiben wrden liegt immerhin der richtigen abteilung sigkeiten,2022-07-04 18:29:40,Neutral,0.0,Negative,-0.0070156028368794,-0.0070156028368794,Negative,"{'neg': 0.211, 'neu': 0.789, 'pos': 0.0, 'compound': -0.9892}"
