Kmart Australia,see wallmart raise kmart stay classy australia,wooo always know ted apparently prefers princess gold coast least year wear fabulous little pink tutu bit backstory gold coast bulletin well coverage pay wall remove happy green triangle day ive never conflict doesnt seem odd especially summer month winter month,2019-11-25 07:52:21,Positive,0.4404,Positive,0.0212833333333333,0.0212833333333333,Positive,"{'neg': 0.028, 'neu': 0.707, 'pos': 0.265, 'compound': 0.8939}"
Kmart Australia,frist pacific coast doll get local kmart australia,aww im jelly reason shes really hard find bay area favourite one pc hair soft gorgeous although fair warn hat head difficult put back kmart gift card face value would like sell,2022-03-30 00:35:39,Neutral,0.0,Positive,0.0260393939393939,0.0260393939393939,Positive,"{'neg': 0.128, 'neu': 0.549, 'pos': 0.323, 'compound': 0.8593}"
Kmart Australia,spotted local kmart australia,make actually happy isnt market like gay couple family god damn great bonus happiness doll wealwhair omg go shop kmart day ago saw delete,2020-12-23 12:20:09,Neutral,0.0,Positive,0.03686,0.03686,Positive,"{'neg': 0.124, 'neu': 0.438, 'pos': 0.438, 'compound': 0.9215}"
Kmart Australia,winter break kmart australia,mom live australia still get shocked price difference lol alarm secure theyre mess around,2021-09-24 00:37:13,Neutral,0.0,Negative,-0.0166666666666666,-0.0166666666666666,Negative,"{'neg': 0.336, 'neu': 0.421, 'pos': 0.243, 'compound': -0.25}"
Kmart Australia,kmart melbourne cbd kmart australia new store open spread across three storey melbournes city centre replace target australias flagship store brand poor performance,kmart new sentence never think id see day crazy think kmart brand well australia yet crumble america wonder theyll use modern logo old logo begin look super outdated reminds lot yahoo japan whats cbd get,2021-10-27 01:25:29,Negative,-0.4019,Positive,0.01665,0.01665,Positive,"{'neg': 0.059, 'neu': 0.762, 'pos': 0.179, 'compound': 0.5994}"
Kmart Australia,australias wesfarmers merge discount store kmart target,reason relevant kresge co kmart australia establish joint venture australian supermarket chain cole new world kmart sell remain part venture back partner go name colesmyer time kmart corp us focus store us start go downward spiral target kmart store retain name remain separate merger,2023-07-26 13:40:02,Neutral,0.0,Neutral,0.0,0.0,Neutral,"{'neg': 0.0, 'neu': 1.0, 'pos': 0.0, 'compound': 0.0}"
Kmart Australia,rayvenfire available kmart australia,appear stock yet store near melbourne nice know itll kmart case miss big w like also regulator target youll probably order store near jealousy increase especially melbourne florida oh australia pick one bad boys well roughcut two new favourite blaster local smyths,2020-06-23 08:33:32,Neutral,0.0,Positive,0.0073999999999999,0.0073999999999999,Positive,"{'neg': 0.145, 'neu': 0.665, 'pos': 0.19, 'compound': 0.3182}"
Kmart Australia,kmart australia,batmobile go look like new film rad ahhh well vic go go look tomorrow,2021-05-23 08:03:11,Neutral,0.0,Positive,0.03716,0.03716,Positive,"{'neg': 0.0, 'neu': 0.723, 'pos': 0.277, 'compound': 0.5574}"
Kmart Australia,kmart australia logo state vernon ct store,pov order sign base google image,2022-05-25 07:52:45,Neutral,0.0,Neutral,0.0,0.0,Neutral,"{'neg': 0.0, 'neu': 1.0, 'pos': 0.0, 'compound': 0.0}"
Kmart Australia,go back get cuties amelie austin kmart australia,reminder allow ask pickup trade buy sell squishmallows user sub welcome rbstsquishmallow bot action perform automatically please contact moderator subredditmessagecomposetorsquishmallow question concern,2023-02-02 23:41:13,Positive,0.4939,Positive,0.0319608695652173,0.0319608695652173,Positive,"{'neg': 0.0, 'neu': 0.725, 'pos': 0.275, 'compound': 0.7351}"
Kmart Australia,even kmart australia know make k sentient monster letter,hate tell people kmart us keep ausnz business would better fortune,2022-04-18 19:47:57,Neutral,0.0,Negative,-0.0168583333333333,-0.0168583333333333,Negative,"{'neg': 0.237, 'neu': 0.577, 'pos': 0.186, 'compound': -0.2023}"
Kmart Australia,grand opening australia first kmart store burwood victoria,gifgiphybrfbqfaosroren,2023-06-20 21:19:47,Positive,0.4588,Neutral,0.0,0.0,Neutral,"{'neg': 0.0, 'neu': 1.0, 'pos': 0.0, 'compound': 0.0}"
Kmart Australia,great lego clearance sale kmart australia today save,,2022-10-18 08:49:57,Positive,0.8074,Neutral,0.0,0.0,Neutral,"{'neg': 0.0, 'neu': 0.0, 'pos': 0.0, 'compound': 0.0}"
Kmart Australia,australia probe retail giant bunnings kmart customer faceprints,really need like fingerprint something need consent collect biometric privacy part overall privacy ease violate privacy shouldnt mitigate factor wait still kmarts australia ah yes kmart formidable retail giant yeah thanks rush covid law,2022-07-16 17:51:07,Neutral,0.0,Positive,0.0248085714285714,0.0248085714285714,Positive,"{'neg': 0.071, 'neu': 0.598, 'pos': 0.332, 'compound': 0.8683}"
Kmart Australia,new nin shirt kmart australia,reckon saw bit ago assed copy copy copy back shirt nice im hold fad gadget knapsack hello fellow marrickvillian ton stock broadway store buck holy shit,2019-08-20 11:32:55,Neutral,0.0,Neutral,0.0009555555555555,0.0009555555555555,Neutral,"{'neg': 0.115, 'neu': 0.735, 'pos': 0.15, 'compound': 0.0258}"
Kmart Australia,find mess drac local kmart victoria australia,look like venus throw dirt litter need someone save lmao hair escape,2023-07-21 00:25:15,Negative,-0.3612,Positive,0.0643076923076923,0.0643076923076923,Positive,"{'neg': 0.116, 'neu': 0.338, 'pos': 0.546, 'compound': 0.836}"
Kmart Australia,new target kmart australia,look cool price point rough ive never hear randomly show kmart australia seem australias get lot stuff america ultra target flash hit multiple join together seem way expensive buy multiple join probably well buy one use small target far know new news couple different target like come year nerf brand make jazwares look like tracer pulse bomb,2020-07-19 10:12:03,Neutral,0.0,Positive,0.0141810344827586,0.0141810344827586,Positive,"{'neg': 0.048, 'neu': 0.746, 'pos': 0.206, 'compound': 0.8225}"
Kmart Australia,find tag kmart western australia ss come soon,yassss thank god australia actually terrible g yayy amazon couldnt life find cleo,2023-07-11 08:28:48,Neutral,0.0,Positive,0.0211428571428571,0.0211428571428571,Positive,"{'neg': 0.178, 'neu': 0.46, 'pos': 0.362, 'compound': 0.296}"
Kmart Australia,rkmartaustralia lounge,,2021-10-11 05:51:39,Neutral,0.0,Neutral,0.0,0.0,Neutral,"{'neg': 0.0, 'neu': 0.0, 'pos': 0.0, 'compound': 0.0}"
Kmart Australia,melbourne australia check kmarts,find scourge road hauler adelaide get first two didnt think kmart still exist especially outside us already mate got hauler burnout week back hey get cube bot back love thing,2022-09-15 10:38:34,Neutral,0.0,Positive,0.0205451612903225,0.0205451612903225,Positive,"{'neg': 0.0, 'neu': 0.873, 'pos': 0.127, 'compound': 0.6369}"
Kmart Australia,look find found local kmart australia fell instantly love buy two,pretty want lovely brb go kmart eta buy clothes kmart big w acknowledge woman interested minnie mouse barbie wonder woman soo cool,2023-08-24 13:40:18,Positive,0.6369,Positive,0.0394,0.0394,Positive,"{'neg': 0.0, 'neu': 0.546, 'pos': 0.454, 'compound': 0.9062}"
Kmart Australia,kmart australia mobile app,yes esp keep receipt easy return etc yes annoy use website find apps save detail tap button thing arrive door dont find website easy use mobile even way prefer shop apps brand buy lot website bad id hate see kind app come probably useless hard navigate yes app would amaze often use target app small feature like scan barcode store see price instead find machine googling also love create wish list able access easily without pull website logging time come soon,2021-11-09 05:29:10,Neutral,0.0,Positive,0.0118353658536585,0.0118353658536585,Positive,"{'neg': 0.124, 'neu': 0.547, 'pos': 0.329, 'compound': 0.9705}"
Kmart Australia,people visitingour kmarts variety store australia kindly leave message dickhead prime minister scott morrison,censor cunt internet youre allow cuss weve make lettered cup say penis point next step sorry awfully write title way fat finger poor proof reading also see people handy work check simpson liberal facebook kmart still thing kmart use america,2020-01-06 07:08:29,Negative,-0.2732,Negative,-0.0201731707317073,-0.0201731707317073,Negative,"{'neg': 0.223, 'neu': 0.737, 'pos': 0.04, 'compound': -0.8271}"
Kmart Australia,kmart australia wingspan aud many others,guy still kmarts australia thats pretty cool buy online sydney delivery thank,2021-11-27 06:08:40,Neutral,0.0,Positive,0.0608153846153846,0.0608153846153846,Positive,"{'neg': 0.0, 'neu': 0.529, 'pos': 0.471, 'compound': 0.7906}"
Kmart Australia,kmart australia photo store layout,accord daily mail article october shopper really dislike new layout credit australian operation try keep time unfortunately us operation fail miserably regard,2021-12-20 03:32:16,Neutral,0.0,Negative,-0.0370260869565217,-0.0370260869565217,Negative,"{'neg': 0.378, 'neu': 0.54, 'pos': 0.083, 'compound': -0.8516}"
Kmart Australia,kmart australia socket wrench set circa inherit dad,even elusive mm love driver handle like good feel look snazzy transparent color handle exact set sit front coffee table right lol get mine grandpa tool bench clear grandparent place feel like pop exact kit us except case green im surprise kmart australia,2020-04-21 23:46:40,Neutral,0.0,Positive,0.021725,0.021725,Positive,"{'neg': 0.0, 'neu': 0.647, 'pos': 0.353, 'compound': 0.9559}"
Kmart Australia,kmart australia stryfe,dont know even possible kmart australia receive cheap orange stryfes convert usd reference us govt stop invading country oil start invade australia cheap stryfes ok time spam purchase ive wait,2020-10-24 06:19:41,Neutral,0.0,Negative,-0.0116516129032258,-0.0116516129032258,Negative,"{'neg': 0.139, 'neu': 0.796, 'pos': 0.065, 'compound': -0.3612}"
Kmart Australia,exclusive kmart australia hope come us eventually,australia exclusive one never come dont get hope always really like see milkshake share though ughhhh cute classic design get mine rare see milkshake design day produce company exclusively produce sell australia head start toy dont think therell official us release private resale,2022-04-21 02:23:59,Positive,0.5267,Positive,0.0164977272727272,0.0164977272727272,Positive,"{'neg': 0.048, 'neu': 0.762, 'pos': 0.19, 'compound': 0.7259}"
Kmart Australia,finish rd project ever learn new stitch progress perfection anko kit kmart australia,love feather head wonderful bought kit super excite opened different pattern inside advertised favorite parrot look well picture packet might go get,2022-08-22 05:23:06,Positive,0.7579,Positive,0.0419043478260869,0.0419043478260869,Positive,"{'neg': 0.0, 'neu': 0.444, 'pos': 0.556, 'compound': 0.9638}"
Kmart Australia,kmart australia car havent heard lot stock go,kmart still around australia awesome,2022-12-02 05:29:19,Neutral,0.0,Positive,0.1041499999999999,0.1041499999999999,Positive,"{'neg': 0.0, 'neu': 0.494, 'pos': 0.506, 'compound': 0.6249}"
Kmart Australia,faboolous pet cleo drac neon fright toralei show kmart scanner australia,like many release get faboolous pet one thought might see weird exclusive store stuff america yay yay assume wouldnt get pk since didnt get multipacks happy,2023-09-24 16:19:19,Negative,-0.3818,Positive,0.0269296296296296,0.0269296296296296,Positive,"{'neg': 0.132, 'neu': 0.563, 'pos': 0.304, 'compound': 0.7271}"
Kmart Australia,retail australia assume im thief,post mark nonpolitical please respect keep discussion topic devoid political material bot action perform automatically please contact moderator subredditmessagecomposetoraustralia question concern make much easy people steal backtrack particularly dislike kmart checkout centre store though year ago youd get stopped every shop somebody check bag anything find gotten good underpaid casual staff cant stuff anymore pretend look scan barcode accord report colsworth target etc loss theft last quarter dont think personally steal know lot people deep man retailer always check bag receipt,2023-09-24 11:24:22,Negative,-0.5267,Positive,0.003340243902439,0.003340243902439,Positive,"{'neg': 0.136, 'neu': 0.696, 'pos': 0.167, 'compound': 0.2739}"
Kmart Australia,true floral print wendy kmart australia exclusive,live united state see grabber claw machine think saw walgreens well im positive shes,2022-04-20 15:09:23,Positive,0.5106,Positive,0.0545066666666666,0.0545066666666666,Positive,"{'neg': 0.0, 'neu': 0.564, 'pos': 0.436, 'compound': 0.8176}"
Kmart Australia,kmart australia suffers data breach,jesus kmart fuck idiots hacker simply send followup phishing email every customer email breach fake userlogin resetrequest steal rest information shit even bad david jones wwwitnewscomaunewsdavidjoneswebsitehackedcustomerdatastolenaspx good weekend try exploit day everyones either go away long weekend mind wander company since report intrusion australian federal police office australian information commissioner company steal people private data report theft people private data federal institution steal people private data else sick bullshit another deliberate leak personal information people foolish believe simple script kiddy hacker attack large orginisations deliberate well orchestrate plan leak people private information universe simply dont trust company leak sell data use lame excuse like hacker,2015-10-01 23:06:40,Negative,-0.4767,Negative,-0.0093443396226415,-0.0093443396226415,Negative,"{'neg': 0.349, 'neu': 0.589, 'pos': 0.062, 'compound': -0.9905}"
Kmart Australia,tomtmusic redwalls coverkmart australia,note reader account ufineants low karma may throwaway low activity account still attempt provide answer know may get reply acknowledge solve get point ufineants reply comment show youre likely participate thread add additional detail please read mark post solve havent already thanks bot action perform automatically please contact moderator subredditmessagecomposetortipofmytongue question concern appreciate help even idea help find click youd like notify post solve type ojjqo message subject hasnt already fill,2021-06-22 10:09:21,Neutral,0.0,Positive,0.0124986111111111,0.0124986111111111,Positive,"{'neg': 0.077, 'neu': 0.684, 'pos': 0.239, 'compound': 0.8999}"
Kmart Australia,australia hasbro zoids stock kmart perth australia,im go kmart look zoids sentence lose time oooh im go need check local kmart wife work kmarts head office look stock level ill see dig report back always funny kmart normal store australia us place get bitten raccoon think theyre go survive time around sad see hasbro give promotional stuff put around,2021-04-03 05:27:05,Neutral,0.0,Negative,-0.0122166666666666,-0.0122166666666666,Negative,"{'neg': 0.141, 'neu': 0.789, 'pos': 0.069, 'compound': -0.6597}"
Kmart Australia,kmart australia success factor id,find id yet find id anyones still look company id kmartaustr,2020-09-28 11:38:52,Positive,0.5719,Neutral,0.0,0.0,Neutral,"{'neg': 0.0, 'neu': 1.0, 'pos': 0.0, 'compound': 0.0}"
Kmart Australia,fit small child kmart l microwave stay classy australia,fit small child kmart l microwave stay classy australia point commentssubmitted hour ago grannymatt raustralia comment seeder murdoch crossover,2023-07-13 23:21:44,Positive,0.6597,Positive,0.032985,0.032985,Positive,"{'neg': 0.0, 'neu': 0.748, 'pos': 0.252, 'compound': 0.6597}"
Kmart Australia,kmart australia,kmart australia well course thing kmart target australia common us counterparts name australian corporation wesfarmers buy australian right use name,2021-05-20 18:36:08,Neutral,0.0,Positive,0.0130095238095238,0.0130095238095238,Positive,"{'neg': 0.0, 'neu': 0.9, 'pos': 0.1, 'compound': 0.2732}"
Kmart Australia,target kmart australia pull gta v shelf,dont understand let tell australian boy call anders behring breivik guy use play video game like world warcraft call duty go murdered people get know play video game course initial knee jerk reaction pull title shelf sell come back people realize cant ban thing murderer like exclusive like murderer like doesnt like murderer reason ban first place million people play world warcraft never murder people time medium stop blatant witch hunt video game theres lot bad thing show hbo wow cod thats even discuss thats tv tv always get free pas dumb people search dexter go murder husband tv reaction show stocking month problem petition state gta v game encourage player murder woman entertainment yeah fuck right even played game obviously havent australia target americas target different target perfectly fine retailer dont want sell product whatever reason able take shelf however business stand point dont see point behind youll make minority people happy also miss able sell one best sell game best sell game,2014-12-04 04:57:36,Neutral,0.0,Positive,0.0060321212121212,0.0060321212121212,Positive,"{'neg': 0.115, 'neu': 0.526, 'pos': 0.359, 'compound': 0.9953}"
Kmart Australia,kmart australia release sex family doll,doll finally able get marry sex marriage legal make glow inside really comparatively small thing thats really make smile,2019-10-28 20:48:02,Neutral,0.0,Positive,0.02535,0.02535,Positive,"{'neg': 0.0, 'neu': 0.799, 'pos': 0.201, 'compound': 0.507}"
Kmart Australia,old kmart australia label scar,original kmart logo store,2020-08-24 02:58:08,Neutral,0.0,Positive,0.06364,0.06364,Positive,"{'neg': 0.0, 'neu': 0.566, 'pos': 0.434, 'compound': 0.3182}"
Kmart Australia,kmart matte spray varnish australia good sealing doll,,2023-03-07 18:21:00,Positive,0.4404,Neutral,0.0,0.0,Neutral,"{'neg': 0.0, 'neu': 0.0, 'pos': 0.0, 'compound': 0.0}"
Kmart Australia,gta v remove targetkmart australia,apparently australian woman gta v literally woman beat simulator great logic right doesnt also encourage murder men entertainment go ban selling alchohol since much strong establish link domestic violence woman edit answer myselfnever since woman also love get totally rekt petition bring back gta v anyones interested game encourage player murder woman entertainment description read incentive commit sexual violence woman abuse kill proceed get health point target stock promote xmas stock please target appeal woman survivor violence include woman experience violence sex industry immediately withdraw grand theft auto v sale im surprise didnt namedrop sarkeesian,2014-12-04 04:03:49,Neutral,0.0,Positive,0.0077177083333333,0.0077177083333333,Positive,"{'neg': 0.234, 'neu': 0.463, 'pos': 0.303, 'compound': 0.7409}"
Kmart Australia,kmart australiafinally restock shocked great morning,alot kmarts australia,2021-02-27 00:21:08,Positive,0.4215,Neutral,0.0,0.0,Neutral,"{'neg': 0.0, 'neu': 1.0, 'pos': 0.0, 'compound': 0.0}"
Kmart Australia,official bakugan tin gen kmart australia,finally finally want love kmart say valuable put security band,2023-08-10 05:10:52,Neutral,0.0,Positive,0.0795454545454545,0.0795454545454545,Positive,"{'neg': 0.0, 'neu': 0.353, 'pos': 0.647, 'compound': 0.875}"
Kmart Australia,dan andrew promotes kmart australia,,2021-02-16 02:02:54,Positive,0.34,Neutral,0.0,0.0,Neutral,"{'neg': 0.0, 'neu': 0.0, 'pos': 0.0, 'compound': 0.0}"
Kmart Australia,kmart australia sale seem bit late,nobody want ford gt lol late kmart sale well still find honda city others though sell,2021-12-11 01:50:44,Neutral,0.0,Positive,0.0437058823529411,0.0437058823529411,Positive,"{'neg': 0.0, 'neu': 0.591, 'pos': 0.409, 'compound': 0.743}"
Kmart Australia,get christmas latern kmart australia today,im excite melbourne store open go rush tagret big w kmart buy decoration kmart best christmas display everwent every thanksgiving night awesome thats adorable cute,2020-10-21 07:11:31,Neutral,0.0,Positive,0.0367653846153846,0.0367653846153846,Positive,"{'neg': 0.0, 'neu': 0.519, 'pos': 0.481, 'compound': 0.9559}"
Kmart Australia,kmart australia catalogue way back new bargain,first console man bring back memory back hand hold hell lot expensive dad couldnt afford afford wouldnt pay either like mobile phone start really expensive nokia come scene make cheaper recently apple google samsung jack price anyone see price new xbox insane one reason give console gaming curious find google lie around whats todays dollar amount,2020-12-08 05:19:53,Positive,0.2023,Negative,-0.0098140350877192,-0.0098140350877192,Negative,"{'neg': 0.142, 'neu': 0.755, 'pos': 0.103, 'compound': -0.5594}"
Kmart Australia,butterfly shepherd cheap pc puzzle kmart australia fun easy average quality expect,,2023-01-12 05:09:02,Positive,0.7351,Neutral,0.0,0.0,Neutral,"{'neg': 0.0, 'neu': 0.0, 'pos': 0.0, 'compound': 0.0}"
Kmart Australia,someone tell name purchase kmart australia swing tag rip,vera give rest info like bio youd like wow ive never see might one favorites name vera shes exclusive australia right,2022-02-02 05:56:52,Neutral,0.0,Positive,0.0410090909090909,0.0410090909090909,Positive,"{'neg': 0.0, 'neu': 0.55, 'pos': 0.45, 'compound': 0.9022}"
Kmart Australia,kmart australia wingspan aud many others,,2021-11-27 07:03:17,Neutral,0.0,Neutral,0.0,0.0,Neutral,"{'neg': 0.0, 'neu': 0.0, 'pos': 0.0, 'compound': 0.0}"
Kmart Australia,extend family pack appear australia pick kmart,wish replace bluey bingo character sometimes love set suppose avoid million blueys lol til australia kmart uncles aunt whyd trixie dirty like bluey bingo core fam extend give aunty give death bob,2022-08-31 07:19:15,Positive,0.1779,Positive,0.0181636363636363,0.0181636363636363,Positive,"{'neg': 0.192, 'neu': 0.512, 'pos': 0.296, 'compound': 0.5994}"
Kmart Australia,find kmart australia buck,didnt know kmarts australia leave like toy r us canada nonusa division actually well thrive ive see swindle face expect toy kingdom kmart disappoint,2019-10-24 09:37:12,Neutral,0.0,Negative,-0.016076,-0.016076,Negative,"{'neg': 0.244, 'neu': 0.602, 'pos': 0.154, 'compound': -0.4019}"
Kmart Australia,kmart australia include bluey print wooden stand paint pot paintbrush,dollar buck thats sick kmart still exist righteous pretty much go us think use love go kmart kid amazing kid gon na love kidding ill get one lucky jealous look great,2021-02-13 07:27:10,Neutral,0.0,Positive,0.029353125,0.029353125,Positive,"{'neg': 0.169, 'neu': 0.39, 'pos': 0.441, 'compound': 0.9393}"
Kmart Australia,topic find local kmart australia,know announce ago figure wouldnt able find australia turn get lucky need find mercedes e amg gt havent even see state want one bad kmart name blast past try big w get stuff like time could leave toysale though dad one say could hit mph th,2018-07-17 21:29:43,Neutral,0.0,Positive,0.0097617021276595,0.0097617021276595,Positive,"{'neg': 0.091, 'neu': 0.739, 'pos': 0.169, 'compound': 0.4588}"
Kmart Australia,nailbiter kmart australia,low ever place still sell grab soon think theyll go fast price im get second one dualwield damn buy one,2020-07-11 03:37:07,Neutral,0.0,Negative,-0.0278999999999999,-0.0278999999999999,Negative,"{'neg': 0.211, 'neu': 0.789, 'pos': 0.0, 'compound': -0.5859}"
Kmart Australia,clear confusion kmart usa kmart australia least understand,kresge kresge majority kmart australia scroll link,2021-03-01 15:59:59,Positive,0.1027,Neutral,0.0,0.0,Neutral,"{'neg': 0.0, 'neu': 1.0, 'pos': 0.0, 'compound': 0.0}"
Kmart Australia,kmart australia exclusive floral squad pic ebay kesla wendy version one find us kroger affiliate,aussie collector didnt know store thank information ill update find next time check kmart im unicorns pretty unicorn ive ever see love squish floral pattern omg beautiful especially cat want lamb im australia figure base listing post ive see love much collect floral squish au squish collector see,2022-02-24 10:50:02,Positive,0.128,Positive,0.0187999999999999,0.0187999999999999,Positive,"{'neg': 0.078, 'neu': 0.651, 'pos': 0.271, 'compound': 0.9212}"
Kmart Australia,kmart australia jordan peterson pyjamas yes buy,belongs rjordanpetersonmemes id totally get one could im go get tomorrow cant believe exist ahahah us lobster pretty popular print casual clothing see everywhere gf even lobster sheet tho isnt familiar jbp hmm must check nz chain,2018-10-21 06:23:59,Positive,0.4019,Positive,0.0204815789473684,0.0204815789473684,Positive,"{'neg': 0.0, 'neu': 0.813, 'pos': 0.187, 'compound': 0.7783}"
Kmart Australia,monster high gen doll australiakmart online,excite mine say stock,2022-10-16 05:08:09,Neutral,0.0,Positive,0.09534,0.09534,Positive,"{'neg': 0.0, 'neu': 0.492, 'pos': 0.508, 'compound': 0.4767}"
Kmart Australia,fit small child kmart l microwave stay classy australia ugrannymatt,,2023-07-14 00:34:51,Positive,0.6597,Neutral,0.0,0.0,Neutral,"{'neg': 0.0, 'neu': 0.0, 'pos': 0.0, 'compound': 0.0}"
Kmart Australia,g australia kmart cost aud,hop find post like hooray goodness dont know get stick either draculaura lagoona wasnt sure comimg australia anytime soon thank post omg state name mr funny man money buy two doll go,2022-10-14 06:59:38,Neutral,0.0,Positive,0.0274242424242424,0.0274242424242424,Positive,"{'neg': 0.047, 'neu': 0.617, 'pos': 0.337, 'compound': 0.905}"
Kmart Australia,buy bookshelf kmart australia whoever design pop vinyl collector,im glad dont addiction must consoom product nothin soy one take mine box ew,2020-02-16 07:27:41,Neutral,0.0,Positive,0.0305866666666666,0.0305866666666666,Positive,"{'neg': 0.0, 'neu': 0.812, 'pos': 0.188, 'compound': 0.4588}"
Kmart Australia,galaxy black series wave hit kmart australia shelf local area,pick tech sing way eb game preorder take long save aud well wish australian store consistent pay extra get zingeb game go target shelf didnt register checkout though sick target wew never bother check kmart thanks tip,2021-11-30 01:05:38,Neutral,0.0,Positive,0.0211578947368421,0.0211578947368421,Positive,"{'neg': 0.099, 'neu': 0.63, 'pos': 0.272, 'compound': 0.804}"
